Frame 2293: Packet, 36 bytes on wire (288 bits), 36 bytes captured (288 bits) on interface \\.\USBPcap3, id 0
    Section number: 1
    Interface id: 0 (\\.\USBPcap3)
        Interface name: \\.\USBPcap3
        Interface description: USBPcap3
    Encapsulation type: USB packets with USBPcap header (152)
    Arrival Time: Mar  6, 2026 02:04:30.742310000 Romance Standard Time
    UTC Arrival Time: Mar  6, 2026 01:04:30.742310000 UTC
    Epoch Arrival Time: 1772759070.742310000
    [Time shift for this packet: 0.000000000 seconds]
    [Time delta from previous captured frame: 9.999642000 seconds]
    [Time since reference or first frame: 23.433362000 seconds]
    Frame Number: 2293
    Frame Length: 36 bytes (288 bits)
    Capture Length: 36 bytes (288 bits)
    [Frame is marked: False]
    [Frame is ignored: False]
    [Protocols in frame: usb:usbhid]
    Character encoding: ASCII (0)
USB URB
    [Source: host]
    [Destination: 3.3.0]
    USBPcap pseudoheader length: 28
    IRP ID: 0xffff81857f608270
    IRP USBD_STATUS: USBD_STATUS_SUCCESS (0x00000000)
    URB Function: URB_FUNCTION_CLASS_INTERFACE (0x001b)
    IRP information: 0x00, Direction: FDO -> PDO
        0000 000. = Reserved: 0x00
        .... ...0 = Direction: FDO -> PDO (0x0)
    URB bus id: 3
    Device address: 3
    Endpoint: 0x00, Direction: OUT
        0... .... = Direction: OUT (0)
        .... 0000 = Endpoint number: 0
    URB transfer type: URB_CONTROL (0x02)
    Packet Data Length: 8
    Control transfer stage: Setup (0)
    [bInterfaceClass: HID (0x03)]
Setup Data
    bmRequestType: 0x21
        0... .... = Direction: Host-to-device
        .01. .... = Type: Class (0x1)
        ...0 0001 = Recipient: Interface (0x01)
    bRequest: SET_IDLE (0x0a)
    wValue: 0x0000
        ReportID: 0
        Duration: 0
    wIndex: 0
    wLength: 0

Frame 2294: Packet, 28 bytes on wire (224 bits), 28 bytes captured (224 bits) on interface \\.\USBPcap3, id 0
    Section number: 1
    Interface id: 0 (\\.\USBPcap3)
        Interface name: \\.\USBPcap3
        Interface description: USBPcap3
    Encapsulation type: USB packets with USBPcap header (152)
    Arrival Time: Mar  6, 2026 02:04:30.742496000 Romance Standard Time
    UTC Arrival Time: Mar  6, 2026 01:04:30.742496000 UTC
    Epoch Arrival Time: 1772759070.742496000
    [Time shift for this packet: 0.000000000 seconds]
    [Time delta from previous captured frame: 186.000 microseconds]
    [Time delta from previous displayed frame: 186.000 microseconds]
    [Time since reference or first frame: 23.433548000 seconds]
    Frame Number: 2294
    Frame Length: 28 bytes (224 bits)
    Capture Length: 28 bytes (224 bits)
    [Frame is marked: False]
    [Frame is ignored: False]
    [Protocols in frame: usb]
    Character encoding: ASCII (0)
USB URB
    [Source: 3.3.0]
    [Destination: host]
    USBPcap pseudoheader length: 28
    IRP ID: 0xffff81857f608270
    IRP USBD_STATUS: USBD_STATUS_SUCCESS (0x00000000)
    URB Function: URB_FUNCTION_CONTROL_TRANSFER (0x0008)
    IRP information: 0x01, Direction: PDO -> FDO
        0000 000. = Reserved: 0x00
        .... ...1 = Direction: PDO -> FDO (0x1)
    URB bus id: 3
    Device address: 3
    Endpoint: 0x00, Direction: OUT
        0... .... = Direction: OUT (0)
        .... 0000 = Endpoint number: 0
    URB transfer type: URB_CONTROL (0x02)
    Packet Data Length: 0
    [Request in: 2293]
    [Time from request: 186.000 microseconds]
    Control transfer stage: Complete (3)
    [bInterfaceClass: HID (0x03)]

Frame 2295: Packet, 27 bytes on wire (216 bits), 27 bytes captured (216 bits) on interface \\.\USBPcap3, id 0
    Section number: 1
    Interface id: 0 (\\.\USBPcap3)
        Interface name: \\.\USBPcap3
        Interface description: USBPcap3
    Encapsulation type: USB packets with USBPcap header (152)
    Arrival Time: Mar  6, 2026 02:04:30.742515000 Romance Standard Time
    UTC Arrival Time: Mar  6, 2026 01:04:30.742515000 UTC
    Epoch Arrival Time: 1772759070.742515000
    [Time shift for this packet: 0.000000000 seconds]
    [Time delta from previous captured frame: 19.000 microseconds]
    [Time delta from previous displayed frame: 19.000 microseconds]
    [Time since reference or first frame: 23.433567000 seconds]
    Frame Number: 2295
    Frame Length: 27 bytes (216 bits)
    Capture Length: 27 bytes (216 bits)
    [Frame is marked: False]
    [Frame is ignored: False]
    [Protocols in frame: usb]
    Character encoding: ASCII (0)
USB URB
    [Source: host]
    [Destination: 3.3.1]
    USBPcap pseudoheader length: 27
    IRP ID: 0xffff81854f60a010
    IRP USBD_STATUS: USBD_STATUS_SUCCESS (0x00000000)
    URB Function: URB_FUNCTION_BULK_OR_INTERRUPT_TRANSFER (0x0009)
    IRP information: 0x00, Direction: FDO -> PDO
        0000 000. = Reserved: 0x00
        .... ...0 = Direction: FDO -> PDO (0x0)
    URB bus id: 3
    Device address: 3
    Endpoint: 0x81, Direction: IN
        1... .... = Direction: IN (1)
        .... 0001 = Endpoint number: 1
    URB transfer type: URB_INTERRUPT (0x01)
    Packet Data Length: 0
    [bInterfaceClass: HID (0x03)]

Frame 2296: Packet, 27 bytes on wire (216 bits), 27 bytes captured (216 bits) on interface \\.\USBPcap3, id 0
    Section number: 1
    Interface id: 0 (\\.\USBPcap3)
        Interface name: \\.\USBPcap3
        Interface description: USBPcap3
    Encapsulation type: USB packets with USBPcap header (152)
    Arrival Time: Mar  6, 2026 02:04:30.742536000 Romance Standard Time
    UTC Arrival Time: Mar  6, 2026 01:04:30.742536000 UTC
    Epoch Arrival Time: 1772759070.742536000
    [Time shift for this packet: 0.000000000 seconds]
    [Time delta from previous captured frame: 21.000 microseconds]
    [Time delta from previous displayed frame: 21.000 microseconds]
    [Time since reference or first frame: 23.433588000 seconds]
    Frame Number: 2296
    Frame Length: 27 bytes (216 bits)
    Capture Length: 27 bytes (216 bits)
    [Frame is marked: False]
    [Frame is ignored: False]
    [Protocols in frame: usb]
    Character encoding: ASCII (0)
USB URB
    [Source: host]
    [Destination: 3.3.1]
    USBPcap pseudoheader length: 27
    IRP ID: 0xffff81854dab3010
    IRP USBD_STATUS: USBD_STATUS_SUCCESS (0x00000000)
    URB Function: URB_FUNCTION_BULK_OR_INTERRUPT_TRANSFER (0x0009)
    IRP information: 0x00, Direction: FDO -> PDO
        0000 000. = Reserved: 0x00
        .... ...0 = Direction: FDO -> PDO (0x0)
    URB bus id: 3
    Device address: 3
    Endpoint: 0x81, Direction: IN
        1... .... = Direction: IN (1)
        .... 0001 = Endpoint number: 1
    URB transfer type: URB_INTERRUPT (0x01)
    Packet Data Length: 0
    [bInterfaceClass: HID (0x03)]

Frame 2297: Packet, 100 bytes on wire (800 bits), 100 bytes captured (800 bits) on interface \\.\USBPcap3, id 0
    Section number: 1
    Interface id: 0 (\\.\USBPcap3)
        Interface name: \\.\USBPcap3
        Interface description: USBPcap3
    Encapsulation type: USB packets with USBPcap header (152)
    Arrival Time: Mar  6, 2026 02:04:30.742694000 Romance Standard Time
    UTC Arrival Time: Mar  6, 2026 01:04:30.742694000 UTC
    Epoch Arrival Time: 1772759070.742694000
    [Time shift for this packet: 0.000000000 seconds]
    [Time delta from previous captured frame: 158.000 microseconds]
    [Time delta from previous displayed frame: 158.000 microseconds]
    [Time since reference or first frame: 23.433746000 seconds]
    Frame Number: 2297
    Frame Length: 100 bytes (800 bits)
    Capture Length: 100 bytes (800 bits)
    [Frame is marked: False]
    [Frame is ignored: False]
    [Protocols in frame: usb:usbhid]
    Character encoding: ASCII (0)
USB URB
    [Source: host]
    [Destination: 3.3.0]
    USBPcap pseudoheader length: 28
    IRP ID: 0xffff818587e159e0
    IRP USBD_STATUS: USBD_STATUS_SUCCESS (0x00000000)
    URB Function: URB_FUNCTION_CLASS_INTERFACE (0x001b)
    IRP information: 0x00, Direction: FDO -> PDO
        0000 000. = Reserved: 0x00
        .... ...0 = Direction: FDO -> PDO (0x0)
    URB bus id: 3
    Device address: 3
    Endpoint: 0x00, Direction: OUT
        0... .... = Direction: OUT (0)
        .... 0000 = Endpoint number: 0
    URB transfer type: URB_CONTROL (0x02)
    Packet Data Length: 72
    Control transfer stage: Setup (0)
    [bInterfaceClass: HID (0x03)]
Setup Data
    bmRequestType: 0x21
        0... .... = Direction: Host-to-device
        .01. .... = Type: Class (0x1)
        ...0 0001 = Recipient: Interface (0x01)
    bRequest: SET_REPORT (0x09)
    wValue: 0x0302
        ReportID: 2
        ReportType: Feature (3)
    wIndex: 0
    wLength: 64
    Data Fragment: 0201ffffffffffffffffffffffffffffffffffffffffffffffffffffffffffffffff000000000000000000000000000000000000000000000000000000000000

Frame 2298: Packet, 28 bytes on wire (224 bits), 28 bytes captured (224 bits) on interface \\.\USBPcap3, id 0
    Section number: 1
    Interface id: 0 (\\.\USBPcap3)
        Interface name: \\.\USBPcap3
        Interface description: USBPcap3
    Encapsulation type: USB packets with USBPcap header (152)
    Arrival Time: Mar  6, 2026 02:04:30.742944000 Romance Standard Time
    UTC Arrival Time: Mar  6, 2026 01:04:30.742944000 UTC
    Epoch Arrival Time: 1772759070.742944000
    [Time shift for this packet: 0.000000000 seconds]
    [Time delta from previous captured frame: 250.000 microseconds]
    [Time delta from previous displayed frame: 250.000 microseconds]
    [Time since reference or first frame: 23.433996000 seconds]
    Frame Number: 2298
    Frame Length: 28 bytes (224 bits)
    Capture Length: 28 bytes (224 bits)
    [Frame is marked: False]
    [Frame is ignored: False]
    [Protocols in frame: usb]
    Character encoding: ASCII (0)
USB URB
    [Source: 3.3.0]
    [Destination: host]
    USBPcap pseudoheader length: 28
    IRP ID: 0xffff818587e159e0
    IRP USBD_STATUS: USBD_STATUS_SUCCESS (0x00000000)
    URB Function: URB_FUNCTION_CONTROL_TRANSFER (0x0008)
    IRP information: 0x01, Direction: PDO -> FDO
        0000 000. = Reserved: 0x00
        .... ...1 = Direction: PDO -> FDO (0x1)
    URB bus id: 3
    Device address: 3
    Endpoint: 0x00, Direction: OUT
        0... .... = Direction: OUT (0)
        .... 0000 = Endpoint number: 0
    URB transfer type: URB_CONTROL (0x02)
    Packet Data Length: 0
    [Request in: 2297]
    [Time from request: 250.000 microseconds]
    Control transfer stage: Complete (3)
    [bInterfaceClass: HID (0x03)]

Frame 2299: Packet, 36 bytes on wire (288 bits), 36 bytes captured (288 bits) on interface \\.\USBPcap3, id 0
    Section number: 1
    Interface id: 0 (\\.\USBPcap3)
        Interface name: \\.\USBPcap3
        Interface description: USBPcap3
    Encapsulation type: USB packets with USBPcap header (152)
    Arrival Time: Mar  6, 2026 02:04:30.742986000 Romance Standard Time
    UTC Arrival Time: Mar  6, 2026 01:04:30.742986000 UTC
    Epoch Arrival Time: 1772759070.742986000
    [Time shift for this packet: 0.000000000 seconds]
    [Time delta from previous captured frame: 42.000 microseconds]
    [Time delta from previous displayed frame: 42.000 microseconds]
    [Time since reference or first frame: 23.434038000 seconds]
    Frame Number: 2299
    Frame Length: 36 bytes (288 bits)
    Capture Length: 36 bytes (288 bits)
    [Frame is marked: False]
    [Frame is ignored: False]
    [Protocols in frame: usb:usbhid]
    Character encoding: ASCII (0)
USB URB
    [Source: host]
    [Destination: 3.3.0]
    USBPcap pseudoheader length: 28
    IRP ID: 0xffff81856eee99e0
    IRP USBD_STATUS: USBD_STATUS_SUCCESS (0x00000000)
    URB Function: URB_FUNCTION_CLASS_INTERFACE (0x001b)
    IRP information: 0x00, Direction: FDO -> PDO
        0000 000. = Reserved: 0x00
        .... ...0 = Direction: FDO -> PDO (0x0)
    URB bus id: 3
    Device address: 3
    Endpoint: 0x80, Direction: IN
        1... .... = Direction: IN (1)
        .... 0000 = Endpoint number: 0
    URB transfer type: URB_CONTROL (0x02)
    Packet Data Length: 8
    Control transfer stage: Setup (0)
    [bInterfaceClass: HID (0x03)]
Setup Data
    bmRequestType: 0xa1
        1... .... = Direction: Device-to-host
        .01. .... = Type: Class (0x1)
        ...0 0001 = Recipient: Interface (0x01)
    bRequest: GET_REPORT (0x01)
    wValue: 0x0301
        ReportID: 1
        ReportType: Feature (3)
    wIndex: 0
    wLength: 64

Frame 2300: Packet, 92 bytes on wire (736 bits), 92 bytes captured (736 bits) on interface \\.\USBPcap3, id 0
    Section number: 1
    Interface id: 0 (\\.\USBPcap3)
        Interface name: \\.\USBPcap3
        Interface description: USBPcap3
    Encapsulation type: USB packets with USBPcap header (152)
    Arrival Time: Mar  6, 2026 02:04:30.743160000 Romance Standard Time
    UTC Arrival Time: Mar  6, 2026 01:04:30.743160000 UTC
    Epoch Arrival Time: 1772759070.743160000
    [Time shift for this packet: 0.000000000 seconds]
    [Time delta from previous captured frame: 174.000 microseconds]
    [Time delta from previous displayed frame: 174.000 microseconds]
    [Time since reference or first frame: 23.434212000 seconds]
    Frame Number: 2300
    Frame Length: 92 bytes (736 bits)
    Capture Length: 92 bytes (736 bits)
    [Frame is marked: False]
    [Frame is ignored: False]
    [Protocols in frame: usb]
    Character encoding: ASCII (0)
USB URB
    [Source: 3.3.0]
    [Destination: host]
    USBPcap pseudoheader length: 28
    IRP ID: 0xffff81856eee99e0
    IRP USBD_STATUS: USBD_STATUS_SUCCESS (0x00000000)
    URB Function: URB_FUNCTION_CONTROL_TRANSFER (0x0008)
    IRP information: 0x01, Direction: PDO -> FDO
        0000 000. = Reserved: 0x00
        .... ...1 = Direction: PDO -> FDO (0x1)
    URB bus id: 3
    Device address: 3
    Endpoint: 0x80, Direction: IN
        1... .... = Direction: IN (1)
        .... 0000 = Endpoint number: 0
    URB transfer type: URB_CONTROL (0x02)
    Packet Data Length: 64
    [Request in: 2299]
    [Time from request: 174.000 microseconds]
    Control transfer stage: Complete (3)
    [bInterfaceClass: HID (0x03)]

Frame 2301: Packet, 100 bytes on wire (800 bits), 100 bytes captured (800 bits) on interface \\.\USBPcap3, id 0
    Section number: 1
    Interface id: 0 (\\.\USBPcap3)
        Interface name: \\.\USBPcap3
        Interface description: USBPcap3
    Encapsulation type: USB packets with USBPcap header (152)
    Arrival Time: Mar  6, 2026 02:04:30.743174000 Romance Standard Time
    UTC Arrival Time: Mar  6, 2026 01:04:30.743174000 UTC
    Epoch Arrival Time: 1772759070.743174000
    [Time shift for this packet: 0.000000000 seconds]
    [Time delta from previous captured frame: 14.000 microseconds]
    [Time delta from previous displayed frame: 14.000 microseconds]
    [Time since reference or first frame: 23.434226000 seconds]
    Frame Number: 2301
    Frame Length: 100 bytes (800 bits)
    Capture Length: 100 bytes (800 bits)
    [Frame is marked: False]
    [Frame is ignored: False]
    [Protocols in frame: usb:usbhid]
    Character encoding: ASCII (0)
USB URB
    [Source: host]
    [Destination: 3.3.0]
    USBPcap pseudoheader length: 28
    IRP ID: 0xffff818582931010
    IRP USBD_STATUS: USBD_STATUS_SUCCESS (0x00000000)
    URB Function: URB_FUNCTION_CLASS_INTERFACE (0x001b)
    IRP information: 0x00, Direction: FDO -> PDO
        0000 000. = Reserved: 0x00
        .... ...0 = Direction: FDO -> PDO (0x0)
    URB bus id: 3
    Device address: 3
    Endpoint: 0x00, Direction: OUT
        0... .... = Direction: OUT (0)
        .... 0000 = Endpoint number: 0
    URB transfer type: URB_CONTROL (0x02)
    Packet Data Length: 72
    Control transfer stage: Setup (0)
    [bInterfaceClass: HID (0x03)]
Setup Data
    bmRequestType: 0x21
        0... .... = Direction: Host-to-device
        .01. .... = Type: Class (0x1)
        ...0 0001 = Recipient: Interface (0x01)
    bRequest: SET_REPORT (0x09)
    wValue: 0x0302
        ReportID: 2
        ReportType: Feature (3)
    wIndex: 0
    wLength: 64
    Data Fragment: 0202015802003208010100ff000064ff000000000000000000000000000000000000000000000000000000000000000000000000000000000000000000000000

Frame 2302: Packet, 28 bytes on wire (224 bits), 28 bytes captured (224 bits) on interface \\.\USBPcap3, id 0
    Section number: 1
    Interface id: 0 (\\.\USBPcap3)
        Interface name: \\.\USBPcap3
        Interface description: USBPcap3
    Encapsulation type: USB packets with USBPcap header (152)
    Arrival Time: Mar  6, 2026 02:04:30.743780000 Romance Standard Time
    UTC Arrival Time: Mar  6, 2026 01:04:30.743780000 UTC
    Epoch Arrival Time: 1772759070.743780000
    [Time shift for this packet: 0.000000000 seconds]
    [Time delta from previous captured frame: 606.000 microseconds]
    [Time delta from previous displayed frame: 606.000 microseconds]
    [Time since reference or first frame: 23.434832000 seconds]
    Frame Number: 2302
    Frame Length: 28 bytes (224 bits)
    Capture Length: 28 bytes (224 bits)
    [Frame is marked: False]
    [Frame is ignored: False]
    [Protocols in frame: usb]
    Character encoding: ASCII (0)
USB URB
    [Source: 3.3.0]
    [Destination: host]
    USBPcap pseudoheader length: 28
    IRP ID: 0xffff818582931010
    IRP USBD_STATUS: USBD_STATUS_SUCCESS (0x00000000)
    URB Function: URB_FUNCTION_CONTROL_TRANSFER (0x0008)
    IRP information: 0x01, Direction: PDO -> FDO
        0000 000. = Reserved: 0x00
        .... ...1 = Direction: PDO -> FDO (0x1)
    URB bus id: 3
    Device address: 3
    Endpoint: 0x00, Direction: OUT
        0... .... = Direction: OUT (0)
        .... 0000 = Endpoint number: 0
    URB transfer type: URB_CONTROL (0x02)
    Packet Data Length: 0
    [Request in: 2301]
    [Time from request: 606.000 microseconds]
    Control transfer stage: Complete (3)
    [bInterfaceClass: HID (0x03)]

Frame 2303: Packet, 36 bytes on wire (288 bits), 36 bytes captured (288 bits) on interface \\.\USBPcap3, id 0
    Section number: 1
    Interface id: 0 (\\.\USBPcap3)
        Interface name: \\.\USBPcap3
        Interface description: USBPcap3
    Encapsulation type: USB packets with USBPcap header (152)
    Arrival Time: Mar  6, 2026 02:04:30.743801000 Romance Standard Time
    UTC Arrival Time: Mar  6, 2026 01:04:30.743801000 UTC
    Epoch Arrival Time: 1772759070.743801000
    [Time shift for this packet: 0.000000000 seconds]
    [Time delta from previous captured frame: 21.000 microseconds]
    [Time delta from previous displayed frame: 21.000 microseconds]
    [Time since reference or first frame: 23.434853000 seconds]
    Frame Number: 2303
    Frame Length: 36 bytes (288 bits)
    Capture Length: 36 bytes (288 bits)
    [Frame is marked: False]
    [Frame is ignored: False]
    [Protocols in frame: usb:usbhid]
    Character encoding: ASCII (0)
USB URB
    [Source: host]
    [Destination: 3.3.0]
    USBPcap pseudoheader length: 28
    IRP ID: 0xffff81858758f9c0
    IRP USBD_STATUS: USBD_STATUS_SUCCESS (0x00000000)
    URB Function: URB_FUNCTION_CLASS_INTERFACE (0x001b)
    IRP information: 0x00, Direction: FDO -> PDO
        0000 000. = Reserved: 0x00
        .... ...0 = Direction: FDO -> PDO (0x0)
    URB bus id: 3
    Device address: 3
    Endpoint: 0x80, Direction: IN
        1... .... = Direction: IN (1)
        .... 0000 = Endpoint number: 0
    URB transfer type: URB_CONTROL (0x02)
    Packet Data Length: 8
    Control transfer stage: Setup (0)
    [bInterfaceClass: HID (0x03)]
Setup Data
    bmRequestType: 0xa1
        1... .... = Direction: Device-to-host
        .01. .... = Type: Class (0x1)
        ...0 0001 = Recipient: Interface (0x01)
    bRequest: GET_REPORT (0x01)
    wValue: 0x0301
        ReportID: 1
        ReportType: Feature (3)
    wIndex: 0
    wLength: 64

Frame 2304: Packet, 92 bytes on wire (736 bits), 92 bytes captured (736 bits) on interface \\.\USBPcap3, id 0
    Section number: 1
    Interface id: 0 (\\.\USBPcap3)
        Interface name: \\.\USBPcap3
        Interface description: USBPcap3
    Encapsulation type: USB packets with USBPcap header (152)
    Arrival Time: Mar  6, 2026 02:04:30.743988000 Romance Standard Time
    UTC Arrival Time: Mar  6, 2026 01:04:30.743988000 UTC
    Epoch Arrival Time: 1772759070.743988000
    [Time shift for this packet: 0.000000000 seconds]
    [Time delta from previous captured frame: 187.000 microseconds]
    [Time delta from previous displayed frame: 187.000 microseconds]
    [Time since reference or first frame: 23.435040000 seconds]
    Frame Number: 2304
    Frame Length: 92 bytes (736 bits)
    Capture Length: 92 bytes (736 bits)
    [Frame is marked: False]
    [Frame is ignored: False]
    [Protocols in frame: usb]
    Character encoding: ASCII (0)
USB URB
    [Source: 3.3.0]
    [Destination: host]
    USBPcap pseudoheader length: 28
    IRP ID: 0xffff81858758f9c0
    IRP USBD_STATUS: USBD_STATUS_SUCCESS (0x00000000)
    URB Function: URB_FUNCTION_CONTROL_TRANSFER (0x0008)
    IRP information: 0x01, Direction: PDO -> FDO
        0000 000. = Reserved: 0x00
        .... ...1 = Direction: PDO -> FDO (0x1)
    URB bus id: 3
    Device address: 3
    Endpoint: 0x80, Direction: IN
        1... .... = Direction: IN (1)
        .... 0000 = Endpoint number: 0
    URB transfer type: URB_CONTROL (0x02)
    Packet Data Length: 64
    [Request in: 2303]
    [Time from request: 187.000 microseconds]
    Control transfer stage: Complete (3)
    [bInterfaceClass: HID (0x03)]

Frame 2305: Packet, 27 bytes on wire (216 bits), 27 bytes captured (216 bits) on interface \\.\USBPcap3, id 0
    Section number: 1
    Interface id: 0 (\\.\USBPcap3)
        Interface name: \\.\USBPcap3
        Interface description: USBPcap3
    Encapsulation type: USB packets with USBPcap header (152)
    Arrival Time: Mar  6, 2026 02:04:31.753618000 Romance Standard Time
    UTC Arrival Time: Mar  6, 2026 01:04:31.753618000 UTC
    Epoch Arrival Time: 1772759071.753618000
    [Time shift for this packet: 0.000000000 seconds]
    [Time delta from previous captured frame: 1.009630000 seconds]
    [Time delta from previous displayed frame: 1.009630000 seconds]
    [Time since reference or first frame: 24.444670000 seconds]
    Frame Number: 2305
    Frame Length: 27 bytes (216 bits)
    Capture Length: 27 bytes (216 bits)
    [Frame is marked: False]
    [Frame is ignored: False]
    [Protocols in frame: usb]
    Character encoding: ASCII (0)
USB URB
    [Source: 3.3.1]
    [Destination: host]
    USBPcap pseudoheader length: 27
    IRP ID: 0xffff81854f60a010
    IRP USBD_STATUS: USBD_STATUS_CANCELED (0xc0010000)
    URB Function: URB_FUNCTION_BULK_OR_INTERRUPT_TRANSFER (0x0009)
    IRP information: 0x01, Direction: PDO -> FDO
        0000 000. = Reserved: 0x00
        .... ...1 = Direction: PDO -> FDO (0x1)
    URB bus id: 3
    Device address: 3
    Endpoint: 0x81, Direction: IN
        1... .... = Direction: IN (1)
        .... 0001 = Endpoint number: 1
    URB transfer type: URB_INTERRUPT (0x01)
    Packet Data Length: 0
    [Request in: 2295]
    [Time from request: 1.011103000 seconds]
    [bInterfaceClass: HID (0x03)]

Frame 2306: Packet, 27 bytes on wire (216 bits), 27 bytes captured (216 bits) on interface \\.\USBPcap3, id 0
    Section number: 1
    Interface id: 0 (\\.\USBPcap3)
        Interface name: \\.\USBPcap3
        Interface description: USBPcap3
    Encapsulation type: USB packets with USBPcap header (152)
    Arrival Time: Mar  6, 2026 02:04:31.753637000 Romance Standard Time
    UTC Arrival Time: Mar  6, 2026 01:04:31.753637000 UTC
    Epoch Arrival Time: 1772759071.753637000
    [Time shift for this packet: 0.000000000 seconds]
    [Time delta from previous captured frame: 19.000 microseconds]
    [Time delta from previous displayed frame: 19.000 microseconds]
    [Time since reference or first frame: 24.444689000 seconds]
    Frame Number: 2306
    Frame Length: 27 bytes (216 bits)
    Capture Length: 27 bytes (216 bits)
    [Frame is marked: False]
    [Frame is ignored: False]
    [Protocols in frame: usb]
    Character encoding: ASCII (0)
USB URB
    [Source: 3.3.1]
    [Destination: host]
    USBPcap pseudoheader length: 27
    IRP ID: 0xffff81854dab3010
    IRP USBD_STATUS: USBD_STATUS_CANCELED (0xc0010000)
    URB Function: URB_FUNCTION_BULK_OR_INTERRUPT_TRANSFER (0x0009)
    IRP information: 0x01, Direction: PDO -> FDO
        0000 000. = Reserved: 0x00
        .... ...1 = Direction: PDO -> FDO (0x1)
    URB bus id: 3
    Device address: 3
    Endpoint: 0x81, Direction: IN
        1... .... = Direction: IN (1)
        .... 0001 = Endpoint number: 1
    URB transfer type: URB_INTERRUPT (0x01)
    Packet Data Length: 0
    [Request in: 2296]
    [Time from request: 1.011101000 seconds]
    [bInterfaceClass: HID (0x03)]

Frame 2307: Packet, 36 bytes on wire (288 bits), 36 bytes captured (288 bits) on interface \\.\USBPcap3, id 0
    Section number: 1
    Interface id: 0 (\\.\USBPcap3)
        Interface name: \\.\USBPcap3
        Interface description: USBPcap3
    Encapsulation type: USB packets with USBPcap header (152)
    Arrival Time: Mar  6, 2026 02:04:46.606570000 Romance Standard Time
    UTC Arrival Time: Mar  6, 2026 01:04:46.606570000 UTC
    Epoch Arrival Time: 1772759086.606570000
    [Time shift for this packet: 0.000000000 seconds]
    [Time delta from previous captured frame: 14.852933000 seconds]
    [Time delta from previous displayed frame: 14.852933000 seconds]
    [Time since reference or first frame: 39.297622000 seconds]
    Frame Number: 2307
    Frame Length: 36 bytes (288 bits)
    Capture Length: 36 bytes (288 bits)
    [Frame is marked: False]
    [Frame is ignored: False]
    [Protocols in frame: usb:usbhid]
    Character encoding: ASCII (0)
USB URB
    [Source: host]
    [Destination: 3.3.0]
    USBPcap pseudoheader length: 28
    IRP ID: 0xffff8185735dfa40
    IRP USBD_STATUS: USBD_STATUS_SUCCESS (0x00000000)
    URB Function: URB_FUNCTION_CLASS_INTERFACE (0x001b)
    IRP information: 0x00, Direction: FDO -> PDO
        0000 000. = Reserved: 0x00
        .... ...0 = Direction: FDO -> PDO (0x0)
    URB bus id: 3
    Device address: 3
    Endpoint: 0x00, Direction: OUT
        0... .... = Direction: OUT (0)
        .... 0000 = Endpoint number: 0
    URB transfer type: URB_CONTROL (0x02)
    Packet Data Length: 8
    Control transfer stage: Setup (0)
    [bInterfaceClass: HID (0x03)]
Setup Data
    bmRequestType: 0x21
        0... .... = Direction: Host-to-device
        .01. .... = Type: Class (0x1)
        ...0 0001 = Recipient: Interface (0x01)
    bRequest: SET_IDLE (0x0a)
    wValue: 0x0000
        ReportID: 0
        Duration: 0
    wIndex: 0
    wLength: 0

Frame 2308: Packet, 28 bytes on wire (224 bits), 28 bytes captured (224 bits) on interface \\.\USBPcap3, id 0
    Section number: 1
    Interface id: 0 (\\.\USBPcap3)
        Interface name: \\.\USBPcap3
        Interface description: USBPcap3
    Encapsulation type: USB packets with USBPcap header (152)
    Arrival Time: Mar  6, 2026 02:04:46.606812000 Romance Standard Time
    UTC Arrival Time: Mar  6, 2026 01:04:46.606812000 UTC
    Epoch Arrival Time: 1772759086.606812000
    [Time shift for this packet: 0.000000000 seconds]
    [Time delta from previous captured frame: 242.000 microseconds]
    [Time delta from previous displayed frame: 242.000 microseconds]
    [Time since reference or first frame: 39.297864000 seconds]
    Frame Number: 2308
    Frame Length: 28 bytes (224 bits)
    Capture Length: 28 bytes (224 bits)
    [Frame is marked: False]
    [Frame is ignored: False]
    [Protocols in frame: usb]
    Character encoding: ASCII (0)
USB URB
    [Source: 3.3.0]
    [Destination: host]
    USBPcap pseudoheader length: 28
    IRP ID: 0xffff8185735dfa40
    IRP USBD_STATUS: USBD_STATUS_SUCCESS (0x00000000)
    URB Function: URB_FUNCTION_CONTROL_TRANSFER (0x0008)
    IRP information: 0x01, Direction: PDO -> FDO
        0000 000. = Reserved: 0x00
        .... ...1 = Direction: PDO -> FDO (0x1)
    URB bus id: 3
    Device address: 3
    Endpoint: 0x00, Direction: OUT
        0... .... = Direction: OUT (0)
        .... 0000 = Endpoint number: 0
    URB transfer type: URB_CONTROL (0x02)
    Packet Data Length: 0
    [Request in: 2307]
    [Time from request: 242.000 microseconds]
    Control transfer stage: Complete (3)
    [bInterfaceClass: HID (0x03)]

Frame 2309: Packet, 27 bytes on wire (216 bits), 27 bytes captured (216 bits) on interface \\.\USBPcap3, id 0
    Section number: 1
    Interface id: 0 (\\.\USBPcap3)
        Interface name: \\.\USBPcap3
        Interface description: USBPcap3
    Encapsulation type: USB packets with USBPcap header (152)
    Arrival Time: Mar  6, 2026 02:04:46.606836000 Romance Standard Time
    UTC Arrival Time: Mar  6, 2026 01:04:46.606836000 UTC
    Epoch Arrival Time: 1772759086.606836000
    [Time shift for this packet: 0.000000000 seconds]
    [Time delta from previous captured frame: 24.000 microseconds]
    [Time delta from previous displayed frame: 24.000 microseconds]
    [Time since reference or first frame: 39.297888000 seconds]
    Frame Number: 2309
    Frame Length: 27 bytes (216 bits)
    Capture Length: 27 bytes (216 bits)
    [Frame is marked: False]
    [Frame is ignored: False]
    [Protocols in frame: usb]
    Character encoding: ASCII (0)
USB URB
    [Source: host]
    [Destination: 3.3.1]
    USBPcap pseudoheader length: 27
    IRP ID: 0xffff81854f60a010
    IRP USBD_STATUS: USBD_STATUS_SUCCESS (0x00000000)
    URB Function: URB_FUNCTION_BULK_OR_INTERRUPT_TRANSFER (0x0009)
    IRP information: 0x00, Direction: FDO -> PDO
        0000 000. = Reserved: 0x00
        .... ...0 = Direction: FDO -> PDO (0x0)
    URB bus id: 3
    Device address: 3
    Endpoint: 0x81, Direction: IN
        1... .... = Direction: IN (1)
        .... 0001 = Endpoint number: 1
    URB transfer type: URB_INTERRUPT (0x01)
    Packet Data Length: 0
    [bInterfaceClass: HID (0x03)]

Frame 2310: Packet, 27 bytes on wire (216 bits), 27 bytes captured (216 bits) on interface \\.\USBPcap3, id 0
    Section number: 1
    Interface id: 0 (\\.\USBPcap3)
        Interface name: \\.\USBPcap3
        Interface description: USBPcap3
    Encapsulation type: USB packets with USBPcap header (152)
    Arrival Time: Mar  6, 2026 02:04:46.606869000 Romance Standard Time
    UTC Arrival Time: Mar  6, 2026 01:04:46.606869000 UTC
    Epoch Arrival Time: 1772759086.606869000
    [Time shift for this packet: 0.000000000 seconds]
    [Time delta from previous captured frame: 33.000 microseconds]
    [Time delta from previous displayed frame: 33.000 microseconds]
    [Time since reference or first frame: 39.297921000 seconds]
    Frame Number: 2310
    Frame Length: 27 bytes (216 bits)
    Capture Length: 27 bytes (216 bits)
    [Frame is marked: False]
    [Frame is ignored: False]
    [Protocols in frame: usb]
    Character encoding: ASCII (0)
USB URB
    [Source: host]
    [Destination: 3.3.1]
    USBPcap pseudoheader length: 27
    IRP ID: 0xffff81854dab3010
    IRP USBD_STATUS: USBD_STATUS_SUCCESS (0x00000000)
    URB Function: URB_FUNCTION_BULK_OR_INTERRUPT_TRANSFER (0x0009)
    IRP information: 0x00, Direction: FDO -> PDO
        0000 000. = Reserved: 0x00
        .... ...0 = Direction: FDO -> PDO (0x0)
    URB bus id: 3
    Device address: 3
    Endpoint: 0x81, Direction: IN
        1... .... = Direction: IN (1)
        .... 0001 = Endpoint number: 1
    URB transfer type: URB_INTERRUPT (0x01)
    Packet Data Length: 0
    [bInterfaceClass: HID (0x03)]

Frame 2311: Packet, 100 bytes on wire (800 bits), 100 bytes captured (800 bits) on interface \\.\USBPcap3, id 0
    Section number: 1
    Interface id: 0 (\\.\USBPcap3)
        Interface name: \\.\USBPcap3
        Interface description: USBPcap3
    Encapsulation type: USB packets with USBPcap header (152)
    Arrival Time: Mar  6, 2026 02:04:46.607034000 Romance Standard Time
    UTC Arrival Time: Mar  6, 2026 01:04:46.607034000 UTC
    Epoch Arrival Time: 1772759086.607034000
    [Time shift for this packet: 0.000000000 seconds]
    [Time delta from previous captured frame: 165.000 microseconds]
    [Time delta from previous displayed frame: 165.000 microseconds]
    [Time since reference or first frame: 39.298086000 seconds]
    Frame Number: 2311
    Frame Length: 100 bytes (800 bits)
    Capture Length: 100 bytes (800 bits)
    [Frame is marked: False]
    [Frame is ignored: False]
    [Protocols in frame: usb:usbhid]
    Character encoding: ASCII (0)
USB URB
    [Source: host]
    [Destination: 3.3.0]
    USBPcap pseudoheader length: 28
    IRP ID: 0xffff81855eb6ea10
    IRP USBD_STATUS: USBD_STATUS_SUCCESS (0x00000000)
    URB Function: URB_FUNCTION_CLASS_INTERFACE (0x001b)
    IRP information: 0x00, Direction: FDO -> PDO
        0000 000. = Reserved: 0x00
        .... ...0 = Direction: FDO -> PDO (0x0)
    URB bus id: 3
    Device address: 3
    Endpoint: 0x00, Direction: OUT
        0... .... = Direction: OUT (0)
        .... 0000 = Endpoint number: 0
    URB transfer type: URB_CONTROL (0x02)
    Packet Data Length: 72
    Control transfer stage: Setup (0)
    [bInterfaceClass: HID (0x03)]
Setup Data
    bmRequestType: 0x21
        0... .... = Direction: Host-to-device
        .01. .... = Type: Class (0x1)
        ...0 0001 = Recipient: Interface (0x01)
    bRequest: SET_REPORT (0x09)
    wValue: 0x0302
        ReportID: 2
        ReportType: Feature (3)
    wIndex: 0
    wLength: 64
    Data Fragment: 0201ffffffffffffffffffffffffffffffffffffffffffffffffffffffffffffffff000000000000000000000000000000000000000000000000000000000000

Frame 2312: Packet, 28 bytes on wire (224 bits), 28 bytes captured (224 bits) on interface \\.\USBPcap3, id 0
    Section number: 1
    Interface id: 0 (\\.\USBPcap3)
        Interface name: \\.\USBPcap3
        Interface description: USBPcap3
    Encapsulation type: USB packets with USBPcap header (152)
    Arrival Time: Mar  6, 2026 02:04:46.607402000 Romance Standard Time
    UTC Arrival Time: Mar  6, 2026 01:04:46.607402000 UTC
    Epoch Arrival Time: 1772759086.607402000
    [Time shift for this packet: 0.000000000 seconds]
    [Time delta from previous captured frame: 368.000 microseconds]
    [Time delta from previous displayed frame: 368.000 microseconds]
    [Time since reference or first frame: 39.298454000 seconds]
    Frame Number: 2312
    Frame Length: 28 bytes (224 bits)
    Capture Length: 28 bytes (224 bits)
    [Frame is marked: False]
    [Frame is ignored: False]
    [Protocols in frame: usb]
    Character encoding: ASCII (0)
USB URB
    [Source: 3.3.0]
    [Destination: host]
    USBPcap pseudoheader length: 28
    IRP ID: 0xffff81855eb6ea10
    IRP USBD_STATUS: USBD_STATUS_SUCCESS (0x00000000)
    URB Function: URB_FUNCTION_CONTROL_TRANSFER (0x0008)
    IRP information: 0x01, Direction: PDO -> FDO
        0000 000. = Reserved: 0x00
        .... ...1 = Direction: PDO -> FDO (0x1)
    URB bus id: 3
    Device address: 3
    Endpoint: 0x00, Direction: OUT
        0... .... = Direction: OUT (0)
        .... 0000 = Endpoint number: 0
    URB transfer type: URB_CONTROL (0x02)
    Packet Data Length: 0
    [Request in: 2311]
    [Time from request: 368.000 microseconds]
    Control transfer stage: Complete (3)
    [bInterfaceClass: HID (0x03)]

Frame 2313: Packet, 36 bytes on wire (288 bits), 36 bytes captured (288 bits) on interface \\.\USBPcap3, id 0
    Section number: 1
    Interface id: 0 (\\.\USBPcap3)
        Interface name: \\.\USBPcap3
        Interface description: USBPcap3
    Encapsulation type: USB packets with USBPcap header (152)
    Arrival Time: Mar  6, 2026 02:04:46.607430000 Romance Standard Time
    UTC Arrival Time: Mar  6, 2026 01:04:46.607430000 UTC
    Epoch Arrival Time: 1772759086.607430000
    [Time shift for this packet: 0.000000000 seconds]
    [Time delta from previous captured frame: 28.000 microseconds]
    [Time delta from previous displayed frame: 28.000 microseconds]
    [Time since reference or first frame: 39.298482000 seconds]
    Frame Number: 2313
    Frame Length: 36 bytes (288 bits)
    Capture Length: 36 bytes (288 bits)
    [Frame is marked: False]
    [Frame is ignored: False]
    [Protocols in frame: usb:usbhid]
    Character encoding: ASCII (0)
USB URB
    [Source: host]
    [Destination: 3.3.0]
    USBPcap pseudoheader length: 28
    IRP ID: 0xffff8185614d79f0
    IRP USBD_STATUS: USBD_STATUS_SUCCESS (0x00000000)
    URB Function: URB_FUNCTION_CLASS_INTERFACE (0x001b)
    IRP information: 0x00, Direction: FDO -> PDO
        0000 000. = Reserved: 0x00
        .... ...0 = Direction: FDO -> PDO (0x0)
    URB bus id: 3
    Device address: 3
    Endpoint: 0x80, Direction: IN
        1... .... = Direction: IN (1)
        .... 0000 = Endpoint number: 0
    URB transfer type: URB_CONTROL (0x02)
    Packet Data Length: 8
    Control transfer stage: Setup (0)
    [bInterfaceClass: HID (0x03)]
Setup Data
    bmRequestType: 0xa1
        1... .... = Direction: Device-to-host
        .01. .... = Type: Class (0x1)
        ...0 0001 = Recipient: Interface (0x01)
    bRequest: GET_REPORT (0x01)
    wValue: 0x0301
        ReportID: 1
        ReportType: Feature (3)
    wIndex: 0
    wLength: 64

Frame 2314: Packet, 92 bytes on wire (736 bits), 92 bytes captured (736 bits) on interface \\.\USBPcap3, id 0
    Section number: 1
    Interface id: 0 (\\.\USBPcap3)
        Interface name: \\.\USBPcap3
        Interface description: USBPcap3
    Encapsulation type: USB packets with USBPcap header (152)
    Arrival Time: Mar  6, 2026 02:04:46.607677000 Romance Standard Time
    UTC Arrival Time: Mar  6, 2026 01:04:46.607677000 UTC
    Epoch Arrival Time: 1772759086.607677000
    [Time shift for this packet: 0.000000000 seconds]
    [Time delta from previous captured frame: 247.000 microseconds]
    [Time delta from previous displayed frame: 247.000 microseconds]
    [Time since reference or first frame: 39.298729000 seconds]
    Frame Number: 2314
    Frame Length: 92 bytes (736 bits)
    Capture Length: 92 bytes (736 bits)
    [Frame is marked: False]
    [Frame is ignored: False]
    [Protocols in frame: usb]
    Character encoding: ASCII (0)
USB URB
    [Source: 3.3.0]
    [Destination: host]
    USBPcap pseudoheader length: 28
    IRP ID: 0xffff8185614d79f0
    IRP USBD_STATUS: USBD_STATUS_SUCCESS (0x00000000)
    URB Function: URB_FUNCTION_CONTROL_TRANSFER (0x0008)
    IRP information: 0x01, Direction: PDO -> FDO
        0000 000. = Reserved: 0x00
        .... ...1 = Direction: PDO -> FDO (0x1)
    URB bus id: 3
    Device address: 3
    Endpoint: 0x80, Direction: IN
        1... .... = Direction: IN (1)
        .... 0000 = Endpoint number: 0
    URB transfer type: URB_CONTROL (0x02)
    Packet Data Length: 64
    [Request in: 2313]
    [Time from request: 247.000 microseconds]
    Control transfer stage: Complete (3)
    [bInterfaceClass: HID (0x03)]

Frame 2315: Packet, 100 bytes on wire (800 bits), 100 bytes captured (800 bits) on interface \\.\USBPcap3, id 0
    Section number: 1
    Interface id: 0 (\\.\USBPcap3)
        Interface name: \\.\USBPcap3
        Interface description: USBPcap3
    Encapsulation type: USB packets with USBPcap header (152)
    Arrival Time: Mar  6, 2026 02:04:46.607693000 Romance Standard Time
    UTC Arrival Time: Mar  6, 2026 01:04:46.607693000 UTC
    Epoch Arrival Time: 1772759086.607693000
    [Time shift for this packet: 0.000000000 seconds]
    [Time delta from previous captured frame: 16.000 microseconds]
    [Time delta from previous displayed frame: 16.000 microseconds]
    [Time since reference or first frame: 39.298745000 seconds]
    Frame Number: 2315
    Frame Length: 100 bytes (800 bits)
    Capture Length: 100 bytes (800 bits)
    [Frame is marked: False]
    [Frame is ignored: False]
    [Protocols in frame: usb:usbhid]
    Character encoding: ASCII (0)
USB URB
    [Source: host]
    [Destination: 3.3.0]
    USBPcap pseudoheader length: 28
    IRP ID: 0xffff8185603f19f0
    IRP USBD_STATUS: USBD_STATUS_SUCCESS (0x00000000)
    URB Function: URB_FUNCTION_CLASS_INTERFACE (0x001b)
    IRP information: 0x00, Direction: FDO -> PDO
        0000 000. = Reserved: 0x00
        .... ...0 = Direction: FDO -> PDO (0x0)
    URB bus id: 3
    Device address: 3
    Endpoint: 0x00, Direction: OUT
        0... .... = Direction: OUT (0)
        .... 0000 = Endpoint number: 0
    URB transfer type: URB_CONTROL (0x02)
    Packet Data Length: 72
    Control transfer stage: Setup (0)
    [bInterfaceClass: HID (0x03)]
Setup Data
    bmRequestType: 0x21
        0... .... = Direction: Host-to-device
        .01. .... = Type: Class (0x1)
        ...0 0001 = Recipient: Interface (0x01)
    bRequest: SET_REPORT (0x09)
    wValue: 0x0302
        ReportID: 2
        ReportType: Feature (3)
    wIndex: 0
    wLength: 64
    Data Fragment: 020201580200320801010000ff006400ff0000000000000000000000000000000000000000000000000000000000000000000000000000000000000000000000

Frame 2316: Packet, 28 bytes on wire (224 bits), 28 bytes captured (224 bits) on interface \\.\USBPcap3, id 0
    Section number: 1
    Interface id: 0 (\\.\USBPcap3)
        Interface name: \\.\USBPcap3
        Interface description: USBPcap3
    Encapsulation type: USB packets with USBPcap header (152)
    Arrival Time: Mar  6, 2026 02:04:46.608280000 Romance Standard Time
    UTC Arrival Time: Mar  6, 2026 01:04:46.608280000 UTC
    Epoch Arrival Time: 1772759086.608280000
    [Time shift for this packet: 0.000000000 seconds]
    [Time delta from previous captured frame: 587.000 microseconds]
    [Time delta from previous displayed frame: 587.000 microseconds]
    [Time since reference or first frame: 39.299332000 seconds]
    Frame Number: 2316
    Frame Length: 28 bytes (224 bits)
    Capture Length: 28 bytes (224 bits)
    [Frame is marked: False]
    [Frame is ignored: False]
    [Protocols in frame: usb]
    Character encoding: ASCII (0)
USB URB
    [Source: 3.3.0]
    [Destination: host]
    USBPcap pseudoheader length: 28
    IRP ID: 0xffff8185603f19f0
    IRP USBD_STATUS: USBD_STATUS_SUCCESS (0x00000000)
    URB Function: URB_FUNCTION_CONTROL_TRANSFER (0x0008)
    IRP information: 0x01, Direction: PDO -> FDO
        0000 000. = Reserved: 0x00
        .... ...1 = Direction: PDO -> FDO (0x1)
    URB bus id: 3
    Device address: 3
    Endpoint: 0x00, Direction: OUT
        0... .... = Direction: OUT (0)
        .... 0000 = Endpoint number: 0
    URB transfer type: URB_CONTROL (0x02)
    Packet Data Length: 0
    [Request in: 2315]
    [Time from request: 587.000 microseconds]
    Control transfer stage: Complete (3)
    [bInterfaceClass: HID (0x03)]

Frame 2317: Packet, 36 bytes on wire (288 bits), 36 bytes captured (288 bits) on interface \\.\USBPcap3, id 0
    Section number: 1
    Interface id: 0 (\\.\USBPcap3)
        Interface name: \\.\USBPcap3
        Interface description: USBPcap3
    Encapsulation type: USB packets with USBPcap header (152)
    Arrival Time: Mar  6, 2026 02:04:46.608308000 Romance Standard Time
    UTC Arrival Time: Mar  6, 2026 01:04:46.608308000 UTC
    Epoch Arrival Time: 1772759086.608308000
    [Time shift for this packet: 0.000000000 seconds]
    [Time delta from previous captured frame: 28.000 microseconds]
    [Time delta from previous displayed frame: 28.000 microseconds]
    [Time since reference or first frame: 39.299360000 seconds]
    Frame Number: 2317
    Frame Length: 36 bytes (288 bits)
    Capture Length: 36 bytes (288 bits)
    [Frame is marked: False]
    [Frame is ignored: False]
    [Protocols in frame: usb:usbhid]
    Character encoding: ASCII (0)
USB URB
    [Source: host]
    [Destination: 3.3.0]
    USBPcap pseudoheader length: 28
    IRP ID: 0xffff8184f94b79e0
    IRP USBD_STATUS: USBD_STATUS_SUCCESS (0x00000000)
    URB Function: URB_FUNCTION_CLASS_INTERFACE (0x001b)
    IRP information: 0x00, Direction: FDO -> PDO
        0000 000. = Reserved: 0x00
        .... ...0 = Direction: FDO -> PDO (0x0)
    URB bus id: 3
    Device address: 3
    Endpoint: 0x80, Direction: IN
        1... .... = Direction: IN (1)
        .... 0000 = Endpoint number: 0
    URB transfer type: URB_CONTROL (0x02)
    Packet Data Length: 8
    Control transfer stage: Setup (0)
    [bInterfaceClass: HID (0x03)]
Setup Data
    bmRequestType: 0xa1
        1... .... = Direction: Device-to-host
        .01. .... = Type: Class (0x1)
        ...0 0001 = Recipient: Interface (0x01)
    bRequest: GET_REPORT (0x01)
    wValue: 0x0301
        ReportID: 1
        ReportType: Feature (3)
    wIndex: 0
    wLength: 64

Frame 2318: Packet, 92 bytes on wire (736 bits), 92 bytes captured (736 bits) on interface \\.\USBPcap3, id 0
    Section number: 1
    Interface id: 0 (\\.\USBPcap3)
        Interface name: \\.\USBPcap3
        Interface description: USBPcap3
    Encapsulation type: USB packets with USBPcap header (152)
    Arrival Time: Mar  6, 2026 02:04:46.608564000 Romance Standard Time
    UTC Arrival Time: Mar  6, 2026 01:04:46.608564000 UTC
    Epoch Arrival Time: 1772759086.608564000
    [Time shift for this packet: 0.000000000 seconds]
    [Time delta from previous captured frame: 256.000 microseconds]
    [Time delta from previous displayed frame: 256.000 microseconds]
    [Time since reference or first frame: 39.299616000 seconds]
    Frame Number: 2318
    Frame Length: 92 bytes (736 bits)
    Capture Length: 92 bytes (736 bits)
    [Frame is marked: False]
    [Frame is ignored: False]
    [Protocols in frame: usb]
    Character encoding: ASCII (0)
USB URB
    [Source: 3.3.0]
    [Destination: host]
    USBPcap pseudoheader length: 28
    IRP ID: 0xffff8184f94b79e0
    IRP USBD_STATUS: USBD_STATUS_SUCCESS (0x00000000)
    URB Function: URB_FUNCTION_CONTROL_TRANSFER (0x0008)
    IRP information: 0x01, Direction: PDO -> FDO
        0000 000. = Reserved: 0x00
        .... ...1 = Direction: PDO -> FDO (0x1)
    URB bus id: 3
    Device address: 3
    Endpoint: 0x80, Direction: IN
        1... .... = Direction: IN (1)
        .... 0000 = Endpoint number: 0
    URB transfer type: URB_CONTROL (0x02)
    Packet Data Length: 64
    [Request in: 2317]
    [Time from request: 256.000 microseconds]
    Control transfer stage: Complete (3)
    [bInterfaceClass: HID (0x03)]

Frame 2319: Packet, 27 bytes on wire (216 bits), 27 bytes captured (216 bits) on interface \\.\USBPcap3, id 0
    Section number: 1
    Interface id: 0 (\\.\USBPcap3)
        Interface name: \\.\USBPcap3
        Interface description: USBPcap3
    Encapsulation type: USB packets with USBPcap header (152)
    Arrival Time: Mar  6, 2026 02:04:47.621137000 Romance Standard Time
    UTC Arrival Time: Mar  6, 2026 01:04:47.621137000 UTC
    Epoch Arrival Time: 1772759087.621137000
    [Time shift for this packet: 0.000000000 seconds]
    [Time delta from previous captured frame: 1.012573000 seconds]
    [Time delta from previous displayed frame: 1.012573000 seconds]
    [Time since reference or first frame: 40.312189000 seconds]
    Frame Number: 2319
    Frame Length: 27 bytes (216 bits)
    Capture Length: 27 bytes (216 bits)
    [Frame is marked: False]
    [Frame is ignored: False]
    [Protocols in frame: usb]
    Character encoding: ASCII (0)
USB URB
    [Source: 3.3.1]
    [Destination: host]
    USBPcap pseudoheader length: 27
    IRP ID: 0xffff81854f60a010
    IRP USBD_STATUS: USBD_STATUS_CANCELED (0xc0010000)
    URB Function: URB_FUNCTION_BULK_OR_INTERRUPT_TRANSFER (0x0009)
    IRP information: 0x01, Direction: PDO -> FDO
        0000 000. = Reserved: 0x00
        .... ...1 = Direction: PDO -> FDO (0x1)
    URB bus id: 3
    Device address: 3
    Endpoint: 0x81, Direction: IN
        1... .... = Direction: IN (1)
        .... 0001 = Endpoint number: 1
    URB transfer type: URB_INTERRUPT (0x01)
    Packet Data Length: 0
    [Request in: 2309]
    [Time from request: 1.014301000 seconds]
    [bInterfaceClass: HID (0x03)]

Frame 2320: Packet, 27 bytes on wire (216 bits), 27 bytes captured (216 bits) on interface \\.\USBPcap3, id 0
    Section number: 1
    Interface id: 0 (\\.\USBPcap3)
        Interface name: \\.\USBPcap3
        Interface description: USBPcap3
    Encapsulation type: USB packets with USBPcap header (152)
    Arrival Time: Mar  6, 2026 02:04:47.621166000 Romance Standard Time
    UTC Arrival Time: Mar  6, 2026 01:04:47.621166000 UTC
    Epoch Arrival Time: 1772759087.621166000
    [Time shift for this packet: 0.000000000 seconds]
    [Time delta from previous captured frame: 29.000 microseconds]
    [Time delta from previous displayed frame: 29.000 microseconds]
    [Time since reference or first frame: 40.312218000 seconds]
    Frame Number: 2320
    Frame Length: 27 bytes (216 bits)
    Capture Length: 27 bytes (216 bits)
    [Frame is marked: False]
    [Frame is ignored: False]
    [Protocols in frame: usb]
    Character encoding: ASCII (0)
USB URB
    [Source: 3.3.1]
    [Destination: host]
    USBPcap pseudoheader length: 27
    IRP ID: 0xffff81854dab3010
    IRP USBD_STATUS: USBD_STATUS_CANCELED (0xc0010000)
    URB Function: URB_FUNCTION_BULK_OR_INTERRUPT_TRANSFER (0x0009)
    IRP information: 0x01, Direction: PDO -> FDO
        0000 000. = Reserved: 0x00
        .... ...1 = Direction: PDO -> FDO (0x1)
    URB bus id: 3
    Device address: 3
    Endpoint: 0x81, Direction: IN
        1... .... = Direction: IN (1)
        .... 0001 = Endpoint number: 1
    URB transfer type: URB_INTERRUPT (0x01)
    Packet Data Length: 0
    [Request in: 2310]
    [Time from request: 1.014297000 seconds]
    [bInterfaceClass: HID (0x03)]

Frame 2321: Packet, 36 bytes on wire (288 bits), 36 bytes captured (288 bits) on interface \\.\USBPcap3, id 0
    Section number: 1
    Interface id: 0 (\\.\USBPcap3)
        Interface name: \\.\USBPcap3
        Interface description: USBPcap3
    Encapsulation type: USB packets with USBPcap header (152)
    Arrival Time: Mar  6, 2026 02:04:59.963445000 Romance Standard Time
    UTC Arrival Time: Mar  6, 2026 01:04:59.963445000 UTC
    Epoch Arrival Time: 1772759099.963445000
    [Time shift for this packet: 0.000000000 seconds]
    [Time delta from previous captured frame: 12.342279000 seconds]
    [Time delta from previous displayed frame: 12.342279000 seconds]
    [Time since reference or first frame: 52.654497000 seconds]
    Frame Number: 2321
    Frame Length: 36 bytes (288 bits)
    Capture Length: 36 bytes (288 bits)
    [Frame is marked: False]
    [Frame is ignored: False]
    [Protocols in frame: usb:usbhid]
    Character encoding: ASCII (0)
USB URB
    [Source: host]
    [Destination: 3.3.0]
    USBPcap pseudoheader length: 28
    IRP ID: 0xffff81856df31010
    IRP USBD_STATUS: USBD_STATUS_SUCCESS (0x00000000)
    URB Function: URB_FUNCTION_CLASS_INTERFACE (0x001b)
    IRP information: 0x00, Direction: FDO -> PDO
        0000 000. = Reserved: 0x00
        .... ...0 = Direction: FDO -> PDO (0x0)
    URB bus id: 3
    Device address: 3
    Endpoint: 0x00, Direction: OUT
        0... .... = Direction: OUT (0)
        .... 0000 = Endpoint number: 0
    URB transfer type: URB_CONTROL (0x02)
    Packet Data Length: 8
    Control transfer stage: Setup (0)
    [bInterfaceClass: HID (0x03)]
Setup Data
    bmRequestType: 0x21
        0... .... = Direction: Host-to-device
        .01. .... = Type: Class (0x1)
        ...0 0001 = Recipient: Interface (0x01)
    bRequest: SET_IDLE (0x0a)
    wValue: 0x0000
        ReportID: 0
        Duration: 0
    wIndex: 0
    wLength: 0

Frame 2322: Packet, 28 bytes on wire (224 bits), 28 bytes captured (224 bits) on interface \\.\USBPcap3, id 0
    Section number: 1
    Interface id: 0 (\\.\USBPcap3)
        Interface name: \\.\USBPcap3
        Interface description: USBPcap3
    Encapsulation type: USB packets with USBPcap header (152)
    Arrival Time: Mar  6, 2026 02:04:59.963625000 Romance Standard Time
    UTC Arrival Time: Mar  6, 2026 01:04:59.963625000 UTC
    Epoch Arrival Time: 1772759099.963625000
    [Time shift for this packet: 0.000000000 seconds]
    [Time delta from previous captured frame: 180.000 microseconds]
    [Time delta from previous displayed frame: 180.000 microseconds]
    [Time since reference or first frame: 52.654677000 seconds]
    Frame Number: 2322
    Frame Length: 28 bytes (224 bits)
    Capture Length: 28 bytes (224 bits)
    [Frame is marked: False]
    [Frame is ignored: False]
    [Protocols in frame: usb]
    Character encoding: ASCII (0)
USB URB
    [Source: 3.3.0]
    [Destination: host]
    USBPcap pseudoheader length: 28
    IRP ID: 0xffff81856df31010
    IRP USBD_STATUS: USBD_STATUS_SUCCESS (0x00000000)
    URB Function: URB_FUNCTION_CONTROL_TRANSFER (0x0008)
    IRP information: 0x01, Direction: PDO -> FDO
        0000 000. = Reserved: 0x00
        .... ...1 = Direction: PDO -> FDO (0x1)
    URB bus id: 3
    Device address: 3
    Endpoint: 0x00, Direction: OUT
        0... .... = Direction: OUT (0)
        .... 0000 = Endpoint number: 0
    URB transfer type: URB_CONTROL (0x02)
    Packet Data Length: 0
    [Request in: 2321]
    [Time from request: 180.000 microseconds]
    Control transfer stage: Complete (3)
    [bInterfaceClass: HID (0x03)]

Frame 2323: Packet, 27 bytes on wire (216 bits), 27 bytes captured (216 bits) on interface \\.\USBPcap3, id 0
    Section number: 1
    Interface id: 0 (\\.\USBPcap3)
        Interface name: \\.\USBPcap3
        Interface description: USBPcap3
    Encapsulation type: USB packets with USBPcap header (152)
    Arrival Time: Mar  6, 2026 02:04:59.963639000 Romance Standard Time
    UTC Arrival Time: Mar  6, 2026 01:04:59.963639000 UTC
    Epoch Arrival Time: 1772759099.963639000
    [Time shift for this packet: 0.000000000 seconds]
    [Time delta from previous captured frame: 14.000 microseconds]
    [Time delta from previous displayed frame: 14.000 microseconds]
    [Time since reference or first frame: 52.654691000 seconds]
    Frame Number: 2323
    Frame Length: 27 bytes (216 bits)
    Capture Length: 27 bytes (216 bits)
    [Frame is marked: False]
    [Frame is ignored: False]
    [Protocols in frame: usb]
    Character encoding: ASCII (0)
USB URB
    [Source: host]
    [Destination: 3.3.1]
    USBPcap pseudoheader length: 27
    IRP ID: 0xffff81854f60a010
    IRP USBD_STATUS: USBD_STATUS_SUCCESS (0x00000000)
    URB Function: URB_FUNCTION_BULK_OR_INTERRUPT_TRANSFER (0x0009)
    IRP information: 0x00, Direction: FDO -> PDO
        0000 000. = Reserved: 0x00
        .... ...0 = Direction: FDO -> PDO (0x0)
    URB bus id: 3
    Device address: 3
    Endpoint: 0x81, Direction: IN
        1... .... = Direction: IN (1)
        .... 0001 = Endpoint number: 1
    URB transfer type: URB_INTERRUPT (0x01)
    Packet Data Length: 0
    [bInterfaceClass: HID (0x03)]

Frame 2324: Packet, 27 bytes on wire (216 bits), 27 bytes captured (216 bits) on interface \\.\USBPcap3, id 0
    Section number: 1
    Interface id: 0 (\\.\USBPcap3)
        Interface name: \\.\USBPcap3
        Interface description: USBPcap3
    Encapsulation type: USB packets with USBPcap header (152)
    Arrival Time: Mar  6, 2026 02:04:59.963675000 Romance Standard Time
    UTC Arrival Time: Mar  6, 2026 01:04:59.963675000 UTC
    Epoch Arrival Time: 1772759099.963675000
    [Time shift for this packet: 0.000000000 seconds]
    [Time delta from previous captured frame: 36.000 microseconds]
    [Time delta from previous displayed frame: 36.000 microseconds]
    [Time since reference or first frame: 52.654727000 seconds]
    Frame Number: 2324
    Frame Length: 27 bytes (216 bits)
    Capture Length: 27 bytes (216 bits)
    [Frame is marked: False]
    [Frame is ignored: False]
    [Protocols in frame: usb]
    Character encoding: ASCII (0)
USB URB
    [Source: host]
    [Destination: 3.3.1]
    USBPcap pseudoheader length: 27
    IRP ID: 0xffff81854dab3010
    IRP USBD_STATUS: USBD_STATUS_SUCCESS (0x00000000)
    URB Function: URB_FUNCTION_BULK_OR_INTERRUPT_TRANSFER (0x0009)
    IRP information: 0x00, Direction: FDO -> PDO
        0000 000. = Reserved: 0x00
        .... ...0 = Direction: FDO -> PDO (0x0)
    URB bus id: 3
    Device address: 3
    Endpoint: 0x81, Direction: IN
        1... .... = Direction: IN (1)
        .... 0001 = Endpoint number: 1
    URB transfer type: URB_INTERRUPT (0x01)
    Packet Data Length: 0
    [bInterfaceClass: HID (0x03)]

Frame 2325: Packet, 100 bytes on wire (800 bits), 100 bytes captured (800 bits) on interface \\.\USBPcap3, id 0
    Section number: 1
    Interface id: 0 (\\.\USBPcap3)
        Interface name: \\.\USBPcap3
        Interface description: USBPcap3
    Encapsulation type: USB packets with USBPcap header (152)
    Arrival Time: Mar  6, 2026 02:04:59.963843000 Romance Standard Time
    UTC Arrival Time: Mar  6, 2026 01:04:59.963843000 UTC
    Epoch Arrival Time: 1772759099.963843000
    [Time shift for this packet: 0.000000000 seconds]
    [Time delta from previous captured frame: 168.000 microseconds]
    [Time delta from previous displayed frame: 168.000 microseconds]
    [Time since reference or first frame: 52.654895000 seconds]
    Frame Number: 2325
    Frame Length: 100 bytes (800 bits)
    Capture Length: 100 bytes (800 bits)
    [Frame is marked: False]
    [Frame is ignored: False]
    [Protocols in frame: usb:usbhid]
    Character encoding: ASCII (0)
USB URB
    [Source: host]
    [Destination: 3.3.0]
    USBPcap pseudoheader length: 28
    IRP ID: 0xffff81855e3eb6d0
    IRP USBD_STATUS: USBD_STATUS_SUCCESS (0x00000000)
    URB Function: URB_FUNCTION_CLASS_INTERFACE (0x001b)
    IRP information: 0x00, Direction: FDO -> PDO
        0000 000. = Reserved: 0x00
        .... ...0 = Direction: FDO -> PDO (0x0)
    URB bus id: 3
    Device address: 3
    Endpoint: 0x00, Direction: OUT
        0... .... = Direction: OUT (0)
        .... 0000 = Endpoint number: 0
    URB transfer type: URB_CONTROL (0x02)
    Packet Data Length: 72
    Control transfer stage: Setup (0)
    [bInterfaceClass: HID (0x03)]
Setup Data
    bmRequestType: 0x21
        0... .... = Direction: Host-to-device
        .01. .... = Type: Class (0x1)
        ...0 0001 = Recipient: Interface (0x01)
    bRequest: SET_REPORT (0x09)
    wValue: 0x0302
        ReportID: 2
        ReportType: Feature (3)
    wIndex: 0
    wLength: 64
    Data Fragment: 0201ffffffffffffffffffffffffffffffffffffffffffffffffffffffffffffffff000000000000000000000000000000000000000000000000000000000000

Frame 2326: Packet, 28 bytes on wire (224 bits), 28 bytes captured (224 bits) on interface \\.\USBPcap3, id 0
    Section number: 1
    Interface id: 0 (\\.\USBPcap3)
        Interface name: \\.\USBPcap3
        Interface description: USBPcap3
    Encapsulation type: USB packets with USBPcap header (152)
    Arrival Time: Mar  6, 2026 02:04:59.964102000 Romance Standard Time
    UTC Arrival Time: Mar  6, 2026 01:04:59.964102000 UTC
    Epoch Arrival Time: 1772759099.964102000
    [Time shift for this packet: 0.000000000 seconds]
    [Time delta from previous captured frame: 259.000 microseconds]
    [Time delta from previous displayed frame: 259.000 microseconds]
    [Time since reference or first frame: 52.655154000 seconds]
    Frame Number: 2326
    Frame Length: 28 bytes (224 bits)
    Capture Length: 28 bytes (224 bits)
    [Frame is marked: False]
    [Frame is ignored: False]
    [Protocols in frame: usb]
    Character encoding: ASCII (0)
USB URB
    [Source: 3.3.0]
    [Destination: host]
    USBPcap pseudoheader length: 28
    IRP ID: 0xffff81855e3eb6d0
    IRP USBD_STATUS: USBD_STATUS_SUCCESS (0x00000000)
    URB Function: URB_FUNCTION_CONTROL_TRANSFER (0x0008)
    IRP information: 0x01, Direction: PDO -> FDO
        0000 000. = Reserved: 0x00
        .... ...1 = Direction: PDO -> FDO (0x1)
    URB bus id: 3
    Device address: 3
    Endpoint: 0x00, Direction: OUT
        0... .... = Direction: OUT (0)
        .... 0000 = Endpoint number: 0
    URB transfer type: URB_CONTROL (0x02)
    Packet Data Length: 0
    [Request in: 2325]
    [Time from request: 259.000 microseconds]
    Control transfer stage: Complete (3)
    [bInterfaceClass: HID (0x03)]

Frame 2327: Packet, 36 bytes on wire (288 bits), 36 bytes captured (288 bits) on interface \\.\USBPcap3, id 0
    Section number: 1
    Interface id: 0 (\\.\USBPcap3)
        Interface name: \\.\USBPcap3
        Interface description: USBPcap3
    Encapsulation type: USB packets with USBPcap header (152)
    Arrival Time: Mar  6, 2026 02:04:59.964134000 Romance Standard Time
    UTC Arrival Time: Mar  6, 2026 01:04:59.964134000 UTC
    Epoch Arrival Time: 1772759099.964134000
    [Time shift for this packet: 0.000000000 seconds]
    [Time delta from previous captured frame: 32.000 microseconds]
    [Time delta from previous displayed frame: 32.000 microseconds]
    [Time since reference or first frame: 52.655186000 seconds]
    Frame Number: 2327
    Frame Length: 36 bytes (288 bits)
    Capture Length: 36 bytes (288 bits)
    [Frame is marked: False]
    [Frame is ignored: False]
    [Protocols in frame: usb:usbhid]
    Character encoding: ASCII (0)
USB URB
    [Source: host]
    [Destination: 3.3.0]
    USBPcap pseudoheader length: 28
    IRP ID: 0xffff8184fc7ef9f0
    IRP USBD_STATUS: USBD_STATUS_SUCCESS (0x00000000)
    URB Function: URB_FUNCTION_CLASS_INTERFACE (0x001b)
    IRP information: 0x00, Direction: FDO -> PDO
        0000 000. = Reserved: 0x00
        .... ...0 = Direction: FDO -> PDO (0x0)
    URB bus id: 3
    Device address: 3
    Endpoint: 0x80, Direction: IN
        1... .... = Direction: IN (1)
        .... 0000 = Endpoint number: 0
    URB transfer type: URB_CONTROL (0x02)
    Packet Data Length: 8
    Control transfer stage: Setup (0)
    [bInterfaceClass: HID (0x03)]
Setup Data
    bmRequestType: 0xa1
        1... .... = Direction: Device-to-host
        .01. .... = Type: Class (0x1)
        ...0 0001 = Recipient: Interface (0x01)
    bRequest: GET_REPORT (0x01)
    wValue: 0x0301
        ReportID: 1
        ReportType: Feature (3)
    wIndex: 0
    wLength: 64

Frame 2328: Packet, 92 bytes on wire (736 bits), 92 bytes captured (736 bits) on interface \\.\USBPcap3, id 0
    Section number: 1
    Interface id: 0 (\\.\USBPcap3)
        Interface name: \\.\USBPcap3
        Interface description: USBPcap3
    Encapsulation type: USB packets with USBPcap header (152)
    Arrival Time: Mar  6, 2026 02:04:59.964426000 Romance Standard Time
    UTC Arrival Time: Mar  6, 2026 01:04:59.964426000 UTC
    Epoch Arrival Time: 1772759099.964426000
    [Time shift for this packet: 0.000000000 seconds]
    [Time delta from previous captured frame: 292.000 microseconds]
    [Time delta from previous displayed frame: 292.000 microseconds]
    [Time since reference or first frame: 52.655478000 seconds]
    Frame Number: 2328
    Frame Length: 92 bytes (736 bits)
    Capture Length: 92 bytes (736 bits)
    [Frame is marked: False]
    [Frame is ignored: False]
    [Protocols in frame: usb]
    Character encoding: ASCII (0)
USB URB
    [Source: 3.3.0]
    [Destination: host]
    USBPcap pseudoheader length: 28
    IRP ID: 0xffff8184fc7ef9f0
    IRP USBD_STATUS: USBD_STATUS_SUCCESS (0x00000000)
    URB Function: URB_FUNCTION_CONTROL_TRANSFER (0x0008)
    IRP information: 0x01, Direction: PDO -> FDO
        0000 000. = Reserved: 0x00
        .... ...1 = Direction: PDO -> FDO (0x1)
    URB bus id: 3
    Device address: 3
    Endpoint: 0x80, Direction: IN
        1... .... = Direction: IN (1)
        .... 0000 = Endpoint number: 0
    URB transfer type: URB_CONTROL (0x02)
    Packet Data Length: 64
    [Request in: 2327]
    [Time from request: 292.000 microseconds]
    Control transfer stage: Complete (3)
    [bInterfaceClass: HID (0x03)]

Frame 2329: Packet, 100 bytes on wire (800 bits), 100 bytes captured (800 bits) on interface \\.\USBPcap3, id 0
    Section number: 1
    Interface id: 0 (\\.\USBPcap3)
        Interface name: \\.\USBPcap3
        Interface description: USBPcap3
    Encapsulation type: USB packets with USBPcap header (152)
    Arrival Time: Mar  6, 2026 02:04:59.964458000 Romance Standard Time
    UTC Arrival Time: Mar  6, 2026 01:04:59.964458000 UTC
    Epoch Arrival Time: 1772759099.964458000
    [Time shift for this packet: 0.000000000 seconds]
    [Time delta from previous captured frame: 32.000 microseconds]
    [Time delta from previous displayed frame: 32.000 microseconds]
    [Time since reference or first frame: 52.655510000 seconds]
    Frame Number: 2329
    Frame Length: 100 bytes (800 bits)
    Capture Length: 100 bytes (800 bits)
    [Frame is marked: False]
    [Frame is ignored: False]
    [Protocols in frame: usb:usbhid]
    Character encoding: ASCII (0)
USB URB
    [Source: host]
    [Destination: 3.3.0]
    USBPcap pseudoheader length: 28
    IRP ID: 0xffff81855e3eb6d0
    IRP USBD_STATUS: USBD_STATUS_SUCCESS (0x00000000)
    URB Function: URB_FUNCTION_CLASS_INTERFACE (0x001b)
    IRP information: 0x00, Direction: FDO -> PDO
        0000 000. = Reserved: 0x00
        .... ...0 = Direction: FDO -> PDO (0x0)
    URB bus id: 3
    Device address: 3
    Endpoint: 0x00, Direction: OUT
        0... .... = Direction: OUT (0)
        .... 0000 = Endpoint number: 0
    URB transfer type: URB_CONTROL (0x02)
    Packet Data Length: 72
    Control transfer stage: Setup (0)
    [bInterfaceClass: HID (0x03)]
Setup Data
    bmRequestType: 0x21
        0... .... = Direction: Host-to-device
        .01. .... = Type: Class (0x1)
        ...0 0001 = Recipient: Interface (0x01)
    bRequest: SET_REPORT (0x09)
    wValue: 0x0302
        ReportID: 2
        ReportType: Feature (3)
    wIndex: 0
    wLength: 64
    Data Fragment: 02020158020032080101000000ff640000ff00000000000000000000000000000000000000000000000000000000000000000000000000000000000000000000

Frame 2330: Packet, 28 bytes on wire (224 bits), 28 bytes captured (224 bits) on interface \\.\USBPcap3, id 0
    Section number: 1
    Interface id: 0 (\\.\USBPcap3)
        Interface name: \\.\USBPcap3
        Interface description: USBPcap3
    Encapsulation type: USB packets with USBPcap header (152)
    Arrival Time: Mar  6, 2026 02:04:59.965048000 Romance Standard Time
    UTC Arrival Time: Mar  6, 2026 01:04:59.965048000 UTC
    Epoch Arrival Time: 1772759099.965048000
    [Time shift for this packet: 0.000000000 seconds]
    [Time delta from previous captured frame: 590.000 microseconds]
    [Time delta from previous displayed frame: 590.000 microseconds]
    [Time since reference or first frame: 52.656100000 seconds]
    Frame Number: 2330
    Frame Length: 28 bytes (224 bits)
    Capture Length: 28 bytes (224 bits)
    [Frame is marked: False]
    [Frame is ignored: False]
    [Protocols in frame: usb]
    Character encoding: ASCII (0)
USB URB
    [Source: 3.3.0]
    [Destination: host]
    USBPcap pseudoheader length: 28
    IRP ID: 0xffff81855e3eb6d0
    IRP USBD_STATUS: USBD_STATUS_SUCCESS (0x00000000)
    URB Function: URB_FUNCTION_CONTROL_TRANSFER (0x0008)
    IRP information: 0x01, Direction: PDO -> FDO
        0000 000. = Reserved: 0x00
        .... ...1 = Direction: PDO -> FDO (0x1)
    URB bus id: 3
    Device address: 3
    Endpoint: 0x00, Direction: OUT
        0... .... = Direction: OUT (0)
        .... 0000 = Endpoint number: 0
    URB transfer type: URB_CONTROL (0x02)
    Packet Data Length: 0
    [Request in: 2329]
    [Time from request: 590.000 microseconds]
    Control transfer stage: Complete (3)
    [bInterfaceClass: HID (0x03)]

Frame 2331: Packet, 36 bytes on wire (288 bits), 36 bytes captured (288 bits) on interface \\.\USBPcap3, id 0
    Section number: 1
    Interface id: 0 (\\.\USBPcap3)
        Interface name: \\.\USBPcap3
        Interface description: USBPcap3
    Encapsulation type: USB packets with USBPcap header (152)
    Arrival Time: Mar  6, 2026 02:04:59.965076000 Romance Standard Time
    UTC Arrival Time: Mar  6, 2026 01:04:59.965076000 UTC
    Epoch Arrival Time: 1772759099.965076000
    [Time shift for this packet: 0.000000000 seconds]
    [Time delta from previous captured frame: 28.000 microseconds]
    [Time delta from previous displayed frame: 28.000 microseconds]
    [Time since reference or first frame: 52.656128000 seconds]
    Frame Number: 2331
    Frame Length: 36 bytes (288 bits)
    Capture Length: 36 bytes (288 bits)
    [Frame is marked: False]
    [Frame is ignored: False]
    [Protocols in frame: usb:usbhid]
    Character encoding: ASCII (0)
USB URB
    [Source: host]
    [Destination: 3.3.0]
    USBPcap pseudoheader length: 28
    IRP ID: 0xffff8185614d79f0
    IRP USBD_STATUS: USBD_STATUS_SUCCESS (0x00000000)
    URB Function: URB_FUNCTION_CLASS_INTERFACE (0x001b)
    IRP information: 0x00, Direction: FDO -> PDO
        0000 000. = Reserved: 0x00
        .... ...0 = Direction: FDO -> PDO (0x0)
    URB bus id: 3
    Device address: 3
    Endpoint: 0x80, Direction: IN
        1... .... = Direction: IN (1)
        .... 0000 = Endpoint number: 0
    URB transfer type: URB_CONTROL (0x02)
    Packet Data Length: 8
    Control transfer stage: Setup (0)
    [bInterfaceClass: HID (0x03)]
Setup Data
    bmRequestType: 0xa1
        1... .... = Direction: Device-to-host
        .01. .... = Type: Class (0x1)
        ...0 0001 = Recipient: Interface (0x01)
    bRequest: GET_REPORT (0x01)
    wValue: 0x0301
        ReportID: 1
        ReportType: Feature (3)
    wIndex: 0
    wLength: 64

Frame 2332: Packet, 92 bytes on wire (736 bits), 92 bytes captured (736 bits) on interface \\.\USBPcap3, id 0
    Section number: 1
    Interface id: 0 (\\.\USBPcap3)
        Interface name: \\.\USBPcap3
        Interface description: USBPcap3
    Encapsulation type: USB packets with USBPcap header (152)
    Arrival Time: Mar  6, 2026 02:04:59.965286000 Romance Standard Time
    UTC Arrival Time: Mar  6, 2026 01:04:59.965286000 UTC
    Epoch Arrival Time: 1772759099.965286000
    [Time shift for this packet: 0.000000000 seconds]
    [Time delta from previous captured frame: 210.000 microseconds]
    [Time delta from previous displayed frame: 210.000 microseconds]
    [Time since reference or first frame: 52.656338000 seconds]
    Frame Number: 2332
    Frame Length: 92 bytes (736 bits)
    Capture Length: 92 bytes (736 bits)
    [Frame is marked: False]
    [Frame is ignored: False]
    [Protocols in frame: usb]
    Character encoding: ASCII (0)
USB URB
    [Source: 3.3.0]
    [Destination: host]
    USBPcap pseudoheader length: 28
    IRP ID: 0xffff8185614d79f0
    IRP USBD_STATUS: USBD_STATUS_SUCCESS (0x00000000)
    URB Function: URB_FUNCTION_CONTROL_TRANSFER (0x0008)
    IRP information: 0x01, Direction: PDO -> FDO
        0000 000. = Reserved: 0x00
        .... ...1 = Direction: PDO -> FDO (0x1)
    URB bus id: 3
    Device address: 3
    Endpoint: 0x80, Direction: IN
        1... .... = Direction: IN (1)
        .... 0000 = Endpoint number: 0
    URB transfer type: URB_CONTROL (0x02)
    Packet Data Length: 64
    [Request in: 2331]
    [Time from request: 210.000 microseconds]
    Control transfer stage: Complete (3)
    [bInterfaceClass: HID (0x03)]

Frame 2333: Packet, 27 bytes on wire (216 bits), 27 bytes captured (216 bits) on interface \\.\USBPcap3, id 0
    Section number: 1
    Interface id: 0 (\\.\USBPcap3)
        Interface name: \\.\USBPcap3
        Interface description: USBPcap3
    Encapsulation type: USB packets with USBPcap header (152)
    Arrival Time: Mar  6, 2026 02:05:00.979505000 Romance Standard Time
    UTC Arrival Time: Mar  6, 2026 01:05:00.979505000 UTC
    Epoch Arrival Time: 1772759100.979505000
    [Time shift for this packet: 0.000000000 seconds]
    [Time delta from previous captured frame: 1.014219000 seconds]
    [Time delta from previous displayed frame: 1.014219000 seconds]
    [Time since reference or first frame: 53.670557000 seconds]
    Frame Number: 2333
    Frame Length: 27 bytes (216 bits)
    Capture Length: 27 bytes (216 bits)
    [Frame is marked: False]
    [Frame is ignored: False]
    [Protocols in frame: usb]
    Character encoding: ASCII (0)
USB URB
    [Source: 3.3.1]
    [Destination: host]
    USBPcap pseudoheader length: 27
    IRP ID: 0xffff81854f60a010
    IRP USBD_STATUS: USBD_STATUS_CANCELED (0xc0010000)
    URB Function: URB_FUNCTION_BULK_OR_INTERRUPT_TRANSFER (0x0009)
    IRP information: 0x01, Direction: PDO -> FDO
        0000 000. = Reserved: 0x00
        .... ...1 = Direction: PDO -> FDO (0x1)
    URB bus id: 3
    Device address: 3
    Endpoint: 0x81, Direction: IN
        1... .... = Direction: IN (1)
        .... 0001 = Endpoint number: 1
    URB transfer type: URB_INTERRUPT (0x01)
    Packet Data Length: 0
    [Request in: 2323]
    [Time from request: 1.015866000 seconds]
    [bInterfaceClass: HID (0x03)]

Frame 2334: Packet, 27 bytes on wire (216 bits), 27 bytes captured (216 bits) on interface \\.\USBPcap3, id 0
    Section number: 1
    Interface id: 0 (\\.\USBPcap3)
        Interface name: \\.\USBPcap3
        Interface description: USBPcap3
    Encapsulation type: USB packets with USBPcap header (152)
    Arrival Time: Mar  6, 2026 02:05:00.979537000 Romance Standard Time
    UTC Arrival Time: Mar  6, 2026 01:05:00.979537000 UTC
    Epoch Arrival Time: 1772759100.979537000
    [Time shift for this packet: 0.000000000 seconds]
    [Time delta from previous captured frame: 32.000 microseconds]
    [Time delta from previous displayed frame: 32.000 microseconds]
    [Time since reference or first frame: 53.670589000 seconds]
    Frame Number: 2334
    Frame Length: 27 bytes (216 bits)
    Capture Length: 27 bytes (216 bits)
    [Frame is marked: False]
    [Frame is ignored: False]
    [Protocols in frame: usb]
    Character encoding: ASCII (0)
USB URB
    [Source: 3.3.1]
    [Destination: host]
    USBPcap pseudoheader length: 27
    IRP ID: 0xffff81854dab3010
    IRP USBD_STATUS: USBD_STATUS_CANCELED (0xc0010000)
    URB Function: URB_FUNCTION_BULK_OR_INTERRUPT_TRANSFER (0x0009)
    IRP information: 0x01, Direction: PDO -> FDO
        0000 000. = Reserved: 0x00
        .... ...1 = Direction: PDO -> FDO (0x1)
    URB bus id: 3
    Device address: 3
    Endpoint: 0x81, Direction: IN
        1... .... = Direction: IN (1)
        .... 0001 = Endpoint number: 1
    URB transfer type: URB_INTERRUPT (0x01)
    Packet Data Length: 0
    [Request in: 2324]
    [Time from request: 1.015862000 seconds]
    [bInterfaceClass: HID (0x03)]

